<?xml version="1.0"?>
<peppher:component xmlns:xsi="http://www.w3.org/2001/XMLSchema-instance"
	xmlns:peppher="http://www.peppher.eu/ComponentMetaData0.1" 
	xsi:schemaLocation="http://www.peppher.eu/ComponentMetaData0.1 ComponentMetaData.xsd" >

	<peppher:implementation name="scale_cpu_func">

		<peppher:sourceFiles>
			<peppher:sourceFile name="vector_scale_cpu.c" version="1.0" language="C">
				<peppher:compilation>
					<peppher:compiler>
						<peppher:name>g++</peppher:name>
						<peppher:version>4.5</peppher:version>
						<peppher:flags> </peppher:flags>
					</peppher:compiler>
				</peppher:compilation>
			</peppher:sourceFile>
		</peppher:sourceFiles>

		<peppher:providedInterfaces>
			<peppher:providedInterface name="vector_scale" />
		</peppher:providedInterfaces>

		<peppher:targetPlatform name="CPU">
		</peppher:targetPlatform>

	</peppher:implementation>




</peppher:component>
